gt_id,filename,gt_lines,det_lines,error_description
E012,AddressServiceImpl.java,"(67, 67)","(67, 67)",Replacing .orElseThrow() with .get() in AddressServiceImpl.getById() causes an unhandled NoSuchElementException and returns HTTP 500 instead of the proper HTTP 404 whenever a client requests a non-existent address ID
E004,UserServiceImpl.java,"(74, 79)","(74, 80)",Loading all users before pagination and transform them to DTOs – wrong order
E013,UserServiceImpl.java,"(102, 103)","(102, 103)","Username parameter is concatenated directly into SQL, allowing an attacker to retrieve data via SQL injections"
E010,UserServiceImpl.java,"(181, 181)","(181, 181)",Calling .get() on findByUsername() causes a NoSuchElementException (HTTP 500) on every login attempt with a non-existent username instead of returning the intended HTTP 401 Unauthorized
E009,AddressController.java,"(52, 52)","(52, 52)","The update() endpoint does not validate the UserRequest DTO. Invalid input (e.g., missing required fields) can lead to a 500 Internal Server Error instead of a clear client-facing error"
E015,UserController.java,"(59, 60)","(60, 60)","Removing @PreAuthorize(admin) from the user deletion endpoint allows any authenticated user to permanently delete any account, including all administrators, leading to immediate and irreversible loss of system ownership"
