filename,det_lines,error_description
GlobalExceptionHandler.java,"(1, 50)","Unhandled ValidationException exposes internal details; hypothesizes omission in exception mapping, medium risk of information leakage in error responses"
GlobalExceptionHandler.java,"(1, 50)","No logging of exception stack traces; hypothesizes operational fault reducing debuggability, low direct impact but hinders fault diagnosis"
GlobalExceptionHandler.java,"(1, 50)","MethodArgumentNotValidException handler returns generic messages; hypothesizes design flaw masking specific validation errors, high user confusion and potential security bypass"
AddressRepository.java,"(1, 20)","FindByUserId query not optimized with indexes; hypothesizes physical fault in DB performance, low probability but cumulative slowdown errors"
AddressRepository.java,"(1, 20)","No existsByIdAndUserId for ownership check; hypothesizes security omission, medium risk of unauthorized access propagation"
AddressRepository.java,"(1, 20)","Custom queries vulnerable to injection if params not bound; hypothesizes development fault in JPQL, high if native queries used"
SecurityConfig.java,"(1, 100)","Default password encoder not explicitly strong (e.g., BCrypt); hypothesizes development fault in security configuration, high probability of weak hashing leading to credential compromise failure"
SecurityConfig.java,"(1, 100)","CSRF disabled without justification; hypothesizes intentional but risky config for API-only, medium risk of CSRF attacks if web forms added later, propagation to unauthorized actions"
SecurityConfig.java,"(1, 100)","No HTTPS enforcement in production; hypothesizes environmental fault (non-secure deployment), high severity for data-in-transit exposure leading to interception failures"
UserRepository.java,"(1, 20)","Custom query for findByEmail lacks case-insensitivity; hypothesizes operational fault in user lookup, low impact but potential missed authentications"
UserRepository.java,"(1, 20)","No soft delete support (e.g., deleted flag); hypothesizes permanent deletion fault, medium risk of data loss on accidental removes"
UserRepository.java,"(1, 20)","Pageable queries without sorting defaults; hypothesizes performance fault from unsorted large result sets, high denial-of-service risk"
V2__insert_data.sql,"(1, 20)","Hardcoded test data with plain passwords; hypothesizes security fault in migration, medium exposure if DB dumped"
V2__insert_data.sql,"(1, 20)","No role assignment for inserted users; hypothesizes incomplete setup fault, low runtime error if roles required"
V2__insert_data.sql,"(1, 20)","Sample data violates potential constraints (e.g., invalid addresses); hypothesizes activation fault on migration run, high setup failure"
AddressServiceImpl.java,"(1, 100)","Absence of bounds checking on paged responses in listAddresses; hypothesizes development omission allowing negative page/size parameters, high probability of out-of-bounds errors leading to denial-of-service failure"
AddressController.java,"(1, 50)","DELETE /addresses/{id} lacks ownership check; hypothesizes malicious exploitation fault, high risk of deletion of others' addresses leading to catastrophic integrity failure"
AddressController.java,"(1, 50)","ResponseEntity status codes inconsistent (e.g., 200 for updates instead of 204); hypothesizes minor design inconsistency, low impact but potential confusion in client-side error handling"
BaselineProjectApplication.java,"(1, 20)","No Spring profile activation; hypothesizes environmental fault mismatch, low config deviation errors"
BaselineProjectApplication.java,"(1, 20)","Missing @SpringBootApplication scan for all packages; hypothesizes component discovery fault, medium startup failure risk"
BaselineProjectApplication.java,"(1, 20)","No health check endpoint config; hypothesizes operational monitoring fault, high undetected downtime propagation"
Address.java,"(1, 50)","No unique constraint on critical fields like street+city; hypothesizes design flaw allowing duplicate addresses, medium inconsistency error propagation"
Address.java,"(1, 50)","Enum AddressType not validated at entity level; hypothesizes runtime fault from invalid enum values, low risk with proper service checks"
Address.java,"(1, 50)","Nullable user reference without business rule enforcement; hypothesizes orphaned address fault, high potential for data integrity failure in queries"
UserController.java,"(1, 50)","No rate limiting on login endpoint; hypothesizes interaction fault with external brute-force attacks, high probability of activation leading to authentication failure and system overload"
UserController.java,"(1, 50)","Inadequate error handling for ResourceNotFoundException in GET /users/{id}; hypothesizes omission in controller advice, low risk but could expose stack traces in responses, minor information disclosure failure"
UserServiceImpl.java,"(1, 100)","No input sanitization for user email in createUser method; hypothesizes development fault: unchecked malicious input leading to SQL injection if repository queries are vulnerable, high propagation risk to integrity failure via unauthorized data access"
application.properties,"(1, 50)","Database credentials in plain text; hypothesizes external access fault if file exposed, high confidentiality breach risk"
application.properties,"(1, 50)","Flyway baseline on init disabled; hypothesizes migration fault on clean DB, medium risk of schema errors"
application.properties,"(1, 50)","No logging level for security events; hypothesizes audit fault, low traceability for faults"
V1__create_tables.sql,"(1, 50)","Missing indexes on foreign keys (user_id in address); hypothesizes physical performance fault, high query slowdown leading to timeout failures"
V1__create_tables.sql,"(1, 50)","No unique constraint on user.email; hypothesizes data integrity fault, medium risk of duplicate accounts"
V1__create_tables.sql,"(1, 50)","VARCHAR lengths arbitrary (e.g., email 100); hypothesizes minor overflow risk, low but could truncate valid emails"
User.java,"(1, 100)","No @NotNull on id field in entity; hypothesizes JPA persistence fault, medium probability of null ID insertion leading to unique constraint violations"
User.java,"(1, 100)","Password stored in plain text without hashing indication; hypothesizes critical development fault: security omission, high risk of credential exposure on breach"
User.java,"(1, 100)","CascadeType.ALL on addresses relationship; hypothesizes over-deletion risk, low probability but could orphan or delete unintended data"
